{
  "schemaVersion": "folklore-corpus-lock-v1",
  "source": {
    "repository": "wahhapen/folklore-corpus",
    "tag": "corpus-v0.2.0",
    "asset": "folklore-corpus-v0.2.0.tar.gz",
    "url": "https://github.com/wahhapen/folklore-corpus/releases/download/corpus-v0.2.0/folklore-corpus-v0.2.0.tar.gz"
  },
  "archiveSha256": "f9f4b854af294a883a11caf3e2afe92448bf8072a4ad0e2a43f1a42da16ad2b7",
  "manifestSha256": "8605d05e9858a3480985c3f4553952c4a374ce7bad4d6a7f5ad74672bf1587dd",
  "releaseId": "fa:release:corpus-v0.2.0",
  "version": "0.2.0",
  "manifestSchemaVersion": "folklore-release-manifest-v1"
}
